{
  "artifactApproval": "approved_for_test",
  "changed": true,
  "cpuTestException": true,
  "error": null,
  "executionMode": "controlled-test",
  "frameworkVersion": "0.3.0",
  "harmonyRegistered": true,
  "logAvailableAfterSeconds": 55.00694845199996,
  "packageVersion": "12.10.1.1",
  "plan": [
    "Would retrieve PA 12.10 build 12.10.1.1",
    "Would install odbcinst, unixodbc and unzip if the exact package is absent",
    "Would retrieve secret reference JBLAB-token through azure-key-vault",
    "Would create /opt/jitterbit/Resources/register.json if credentials are absent",
    "Would restart Jitterbit once and monitor /opt/jitterbit/log/jitterbit-agent.log",
    "Would retrieve registration field cloud_url from JBLAB-cloudUrl",
    "Would retrieve registration field agent_group_id from JBLAB-agentGroupId",
    "Would retrieve registration field agent_name_prefix from JBLAB-agentNamePrefix",
    "Would retrieve registration field deregister_on_drainstop from JBLAB-deregisterAgentOnDrainstop",
    "Would retrieve registration field retry_count from JBLAB-retryCount",
    "Would retrieve registration field retry_interval_seconds from JBLAB-retryIntervalSeconds"
  ],
  "platform": {
    "architecture": "x86_64",
    "os": "ubuntu",
    "version": "24.04"
  },
  "productionSizingValidated": false,
  "registrationDurationSeconds": 175.30754504499998,
  "requestedVersion": "12.10",
  "resourcePolicy": "PASS_WITH_TEST_EXCEPTION",
  "runId": "jbpa-0d608ebfb6c0482abca518cd47b6654e",
  "schemaVersion": 2,
  "serviceRunning": true,
  "state": "COMPLETE",
  "stateHistory": [
    "PACKAGE_INSTALLED",
    "OPTIONAL_CONFIGURATION_COMPLETE",
    "REGISTER_JSON_CREATED",
    "AGENT_RESTART_REQUESTED",
    "WAITING_FOR_AGENT_RUNTIME",
    "AGENT_LOG_AVAILABLE",
    "AUTO_REGISTRATION_STARTED",
    "AUTO_REGISTRATION_COMPLETED",
    "CREDENTIALS_CREATED",
    "HARMONY_AUTHENTICATED",
    "AGENT_LOGGED_IN",
    "AGENT_SERVICES_CONNECTED",
    "REQUEST_FLOW_STARTED",
    "AGENT_SYNCHRONIZED",
    "HEARTBEAT_STARTED",
    "LOCAL_SERVICES_HEALTHY",
    "COMPLETE"
  ],
  "status": "COMPLETE",
  "timestamp": "2026-09-25T16:55:03.465526+00:00"
}
